{
 "schema_version": 1,
 "generated_by": "scripts/gen_maps.py",
 "canon_map": {
  "in_casaabuela": "casa",
  "st_propatria": "propatria",
  "tn_propatria__canoamarillo": "tunel1",
  "st_canoamarillo": "canoamarillo",
  "tn_canoamarillo__capitolio": "tunel2",
  "st_capitolio": "capitolio",
  "tn_capitolio__bellasartes": "tunel3",
  "st_bellasartes": "bellasartes",
  "tn_bellasartes__plazavenezuela": "tunel4",
  "st_plazavenezuela": "plazavenezuela",
  "tn_plazavenezuela__sabanagrande": "tunel5",
  "st_sabanagrande": "sabanagrande",
  "tn_sabanagrande__chacaito": "tunel6",
  "st_chacaito": "chacaito",
  "tn_chacaito__altamira": "tunel7",
  "st_altamira": "altamira",
  "tn_altamira__petare": "tunel8",
  "st_petare": "petare"
 },
 "maps": [
  {
   "id": "cb_elmanguito",
   "type": "cable",
   "region": "metrocable_sanagustin",
   "name_es": "Estación El Manguito",
   "name_en": "El Manguito Cable Station",
   "tileset": "ts.sanagustin",
   "dimensions": {
    "w": 24,
    "h": 16
   },
   "connections": [
    {
     "to": "cb_laceiba",
     "via": "cable",
     "gate": "oficio.teleferico"
    },
    {
     "to": "cb_sanagustin",
     "via": "cable",
     "gate": "oficio.teleferico"
    }
   ],
   "features": [],
   "encounters": "enc.cb_elmanguito",
   "npcs": [],
   "events": [],
   "music": "mus.metrocable_sanagustin.cable"
  },
  {
   "id": "cb_hornosdecal",
   "type": "cable",
   "region": "metrocable_sanagustin",
   "name_es": "Estación Hornos de Cal",
   "name_en": "Hornos de Cal Cable Station",
   "tileset": "ts.sanagustin",
   "dimensions": {
    "w": 24,
    "h": 16
   },
   "connections": [
    {
     "to": "st_parquecentral",
     "via": "cable",
     "gate": "oficio.teleferico"
    },
    {
     "to": "cb_laceiba",
     "via": "cable",
     "gate": "oficio.teleferico"
    }
   ],
   "features": [],
   "encounters": "enc.cb_hornosdecal",
   "npcs": [],
   "events": [],
   "music": "mus.metrocable_sanagustin.cable"
  },
  {
   "id": "cb_laceiba",
   "type": "cable",
   "region": "metrocable_sanagustin",
   "name_es": "Estación La Ceiba",
   "name_en": "La Ceiba Cable Station",
   "tileset": "ts.sanagustin",
   "dimensions": {
    "w": 24,
    "h": 16
   },
   "connections": [
    {
     "to": "cb_hornosdecal",
     "via": "cable",
     "gate": "oficio.teleferico"
    },
    {
     "to": "cb_elmanguito",
     "via": "cable",
     "gate": "oficio.teleferico"
    }
   ],
   "features": [],
   "encounters": "enc.cb_laceiba",
   "npcs": [],
   "events": [],
   "music": "mus.metrocable_sanagustin.cable"
  },
  {
   "id": "cb_mariche",
   "type": "cable",
   "region": "metrocable_mariche",
   "name_es": "Estación Mariche",
   "name_en": "Mariche Cable Station",
   "tileset": "ts.mariche",
   "dimensions": {
    "w": 24,
    "h": 16
   },
   "connections": [
    {
     "to": "st_paloverde",
     "via": "cable",
     "gate": "oficio.teleferico"
    }
   ],
   "features": [],
   "encounters": "enc.cb_mariche",
   "npcs": [],
   "events": [],
   "music": "mus.metrocable_mariche.cable"
  },
  {
   "id": "cb_sanagustin",
   "type": "cable",
   "region": "metrocable_sanagustin",
   "name_es": "Estación San Agustín",
   "name_en": "San Agustín Cable Station",
   "tileset": "ts.sanagustin",
   "dimensions": {
    "w": 24,
    "h": 16
   },
   "connections": [
    {
     "to": "cb_elmanguito",
     "via": "cable",
     "gate": "oficio.teleferico"
    }
   ],
   "features": [],
   "encounters": "enc.cb_sanagustin",
   "npcs": [],
   "events": [],
   "music": "mus.metrocable_sanagustin.cable"
  },
  {
   "id": "gh_bellocampo",
   "type": "ghost",
   "region": "linea5",
   "name_es": "Estación fantasma Bello Campo",
   "name_en": "Ghost station Bello Campo",
   "tileset": "ts.fantasma",
   "dimensions": {
    "w": 40,
    "h": 24
   },
   "connections": [
    {
     "to": "tn_chuao__bellocampo",
     "via": "walk",
     "gate": null
    },
    {
     "to": "tn_bellocampo__miranda_l5",
     "via": "walk",
     "gate": null
    }
   ],
   "features": [],
   "encounters": "enc.gh_bellocampo",
   "npcs": [],
   "events": [],
   "music": "mus.linea5.ghost"
  },
  {
   "id": "gh_chuao",
   "type": "ghost",
   "region": "linea5",
   "name_es": "Estación fantasma Chuao",
   "name_en": "Ghost station Chuao",
   "tileset": "ts.fantasma",
   "dimensions": {
    "w": 40,
    "h": 24
   },
   "connections": [
    {
     "to": "tn_tamanaco__chuao",
     "via": "walk",
     "gate": null
    },
    {
     "to": "tn_chuao__bellocampo",
     "via": "walk",
     "gate": null
    }
   ],
   "features": [],
   "encounters": "enc.gh_chuao",
   "npcs": [],
   "events": [],
   "music": "mus.linea5.ghost"
  },
  {
   "id": "gh_lasmercedes",
   "type": "ghost",
   "region": "linea5",
   "name_es": "Estación fantasma Las Mercedes",
   "name_en": "Ghost station Las Mercedes",
   "tileset": "ts.fantasma",
   "dimensions": {
    "w": 40,
    "h": 24
   },
   "connections": [
    {
     "to": "tn_bellomonte__lasmercedes",
     "via": "walk",
     "gate": null
    },
    {
     "to": "tn_lasmercedes__tamanaco",
     "via": "walk",
     "gate": null
    }
   ],
   "features": [],
   "encounters": "enc.gh_lasmercedes",
   "npcs": [],
   "events": [],
   "music": "mus.linea5.ghost"
  },
  {
   "id": "gh_miranda_l5",
   "type": "ghost",
   "region": "linea5",
   "name_es": "Estación fantasma Miranda",
   "name_en": "Ghost station Miranda",
   "tileset": "ts.fantasma",
   "dimensions": {
    "w": 40,
    "h": 24
   },
   "connections": [
    {
     "to": "tn_bellocampo__miranda_l5",
     "via": "walk",
     "gate": null
    }
   ],
   "features": [],
   "encounters": "enc.gh_miranda_l5",
   "npcs": [],
   "events": [],
   "music": "mus.linea5.ghost"
  },
  {
   "id": "gh_tamanaco",
   "type": "ghost",
   "region": "linea5",
   "name_es": "Estación fantasma Tamanaco",
   "name_en": "Ghost station Tamanaco",
   "tileset": "ts.fantasma",
   "dimensions": {
    "w": 40,
    "h": 24
   },
   "connections": [
    {
     "to": "tn_lasmercedes__tamanaco",
     "via": "walk",
     "gate": null
    },
    {
     "to": "tn_tamanaco__chuao",
     "via": "walk",
     "gate": null
    }
   ],
   "features": [],
   "encounters": "enc.gh_tamanaco",
   "npcs": [],
   "events": [],
   "music": "mus.linea5.ghost"
  },
  {
   "id": "in_casaabuela",
   "type": "interior",
   "region": "linea1",
   "name_es": "Casa de la Abuela",
   "name_en": "Grandma's House",
   "tileset": "ts.interior",
   "dimensions": {
    "w": 20,
    "h": 14
   },
   "connections": [
    {
     "to": "st_propatria",
     "via": "warp",
     "gate": null
    }
   ],
   "features": [],
   "encounters": null,
   "npcs": [],
   "events": [],
   "music": "mus.interior.default"
  },
  {
   "id": "in_latorre",
   "type": "interior",
   "region": "losteques",
   "name_es": "La Torre",
   "name_en": "The Tower (battle facility)",
   "tileset": "ts.interior",
   "dimensions": {
    "w": 20,
    "h": 14
   },
   "connections": [
    {
     "to": "st_independencia",
     "via": "warp",
     "gate": null
    }
   ],
   "features": [],
   "encounters": null,
   "npcs": [],
   "events": [],
   "music": "mus.interior.default"
  },
  {
   "id": "in_mercadocirco",
   "type": "interior",
   "region": "linea4",
   "name_es": "Mercado del Coleccionista",
   "name_en": "The Collector's Market",
   "tileset": "ts.interior",
   "dimensions": {
    "w": 20,
    "h": 14
   },
   "connections": [
    {
     "to": "st_nuevocirco",
     "via": "warp",
     "gate": null
    }
   ],
   "features": [],
   "encounters": null,
   "npcs": [],
   "events": [],
   "music": "mus.interior.default"
  },
  {
   "id": "in_safari",
   "type": "interior",
   "region": "linea2",
   "name_es": "Safari del Zoológico",
   "name_en": "Zoo Safari",
   "tileset": "ts.interior",
   "dimensions": {
    "w": 20,
    "h": 14
   },
   "connections": [
    {
     "to": "st_zoologico",
     "via": "warp",
     "gate": null
    }
   ],
   "features": [],
   "encounters": "enc.in_safari",
   "npcs": [],
   "events": [],
   "music": "mus.interior.default"
  },
  {
   "id": "sf_bulevar",
   "type": "surface",
   "region": "superficie",
   "name_es": "Bulevar de Sabana Grande",
   "name_en": "Sabana Grande Boulevard",
   "tileset": "ts.superficie",
   "dimensions": {
    "w": 48,
    "h": 32
   },
   "connections": [
    {
     "to": "st_sabanagrande",
     "via": "warp",
     "gate": null
    }
   ],
   "features": [],
   "encounters": "enc.sf_bulevar",
   "npcs": [],
   "events": [],
   "music": "mus.superficie.day"
  },
  {
   "id": "sf_calvario",
   "type": "surface",
   "region": "superficie",
   "name_es": "El Calvario",
   "name_en": "El Calvario Park",
   "tileset": "ts.superficie",
   "dimensions": {
    "w": 48,
    "h": 32
   },
   "connections": [
    {
     "to": "st_canoamarillo",
     "via": "warp",
     "gate": "oficio.machete"
    }
   ],
   "features": [],
   "encounters": "enc.sf_calvario",
   "npcs": [],
   "events": [],
   "music": "mus.superficie.day"
  },
  {
   "id": "sf_caobos",
   "type": "surface",
   "region": "superficie",
   "name_es": "Parque Los Caobos",
   "name_en": "Los Caobos Park",
   "tileset": "ts.superficie",
   "dimensions": {
    "w": 48,
    "h": 32
   },
   "connections": [
    {
     "to": "st_bellasartes",
     "via": "warp",
     "gate": null
    }
   ],
   "features": [],
   "encounters": "enc.sf_caobos",
   "npcs": [],
   "events": [],
   "music": "mus.superficie.day"
  },
  {
   "id": "sf_cumbre",
   "type": "surface",
   "region": "avila",
   "name_es": "La Cumbre (Hotel Humboldt)",
   "name_en": "The Summit (Hotel Humboldt)",
   "tileset": "ts.avila",
   "dimensions": {
    "w": 48,
    "h": 32
   },
   "connections": [
    {
     "to": "sf_neblina",
     "via": "walk",
     "gate": "oficio.teleferico"
    }
   ],
   "features": [],
   "encounters": "enc.sf_cumbre",
   "npcs": [],
   "events": [],
   "music": "mus.avila.trail"
  },
  {
   "id": "sf_hipica",
   "type": "surface",
   "region": "superficie",